{
  "$schema": "https://json-schema.org/draft/2020-12/schema",
  "$id": "https://raw.githubusercontent.com/MLSecOpsHub/agentic-attack-index/main/schema/incident.schema.json",
  "title": "Agentic Attack Index incident record",
  "description": "One real-world incident of an AI-agent-executed or AI-orchestrated cyberattack. Every factual field must be backed by a cited, resolvable source; unknown values stay null/empty.",
  "type": "object",
  "additionalProperties": false,
  "required": [
    "id",
    "name",
    "summary",
    "date_disclosed",
    "status",
    "confidence",
    "category",
    "severity",
    "models",
    "model_families",
    "actor",
    "actor_type",
    "sources"
  ],
  "properties": {
    "id": {
      "type": "string",
      "description": "Stable kebab-case slug. Permanent: it is the citation key. Never renamed or recycled.",
      "pattern": "^[a-z0-9]+(-[a-z0-9]+)*$",
      "minLength": 3,
      "maxLength": 80
    },
    "name": {
      "type": "string",
      "description": "Short human-readable incident name.",
      "minLength": 3,
      "maxLength": 160
    },
    "summary": {
      "type": "string",
      "description": "Defensive-framing summary at lifecycle level. No exploit code, payloads, prompts, or step-by-step offensive instructions.",
      "minLength": 20
    },
    "date_disclosed": {
      "type": "string",
      "description": "Date the incident was first publicly disclosed (ISO 8601).",
      "format": "date"
    },
    "status": {
      "type": "string",
      "description": "confirmed = multiple independent or first-party confirmation; reported = public reporting not independently confirmed; test-eval = lab test or evaluation, not a real-world attack.",
      "enum": ["confirmed", "reported", "test-eval"]
    },
    "confidence": {
      "type": "string",
      "description": "primary = first-party/primary sourcing; secondary = secondhand reporting; unverified = single unconfirmed source.",
      "enum": ["primary", "secondary", "unverified"]
    },
    "category": {
      "type": "string",
      "enum": [
        "ai-orchestrated-campaign",
        "autonomous-attack",
        "lab-escape-eval",
        "agent-hijack-prompt-injection",
        "infrastructure-abuse-supply-chain"
      ]
    },
    "severity": {
      "type": "string",
      "enum": ["critical", "high", "medium", "low"]
    },
    "models": {
      "type": "array",
      "description": "Specific model names as stated by sources (e.g. a versioned model identifier). Empty if sources do not name a model.",
      "items": { "type": "string", "minLength": 1 },
      "uniqueItems": true
    },
    "model_families": {
      "type": "array",
      "description": "Controlled vocabulary of model families involved. Use 'other' when sources name no covered family.",
      "items": {
        "type": "string",
        "enum": [
          "claude",
          "openai-gpt",
          "openai-codex",
          "gemini",
          "deepseek",
          "qwen",
          "llama",
          "mistral",
          "hermes",
          "other"
        ]
      },
      "uniqueItems": true
    },
    "actor": {
      "type": "string",
      "description": "Threat actor as stated by sources. 'Unknown' is a valid value; never attribute beyond sources.",
      "minLength": 1
    },
    "actor_type": {
      "type": "string",
      "enum": [
        "nation-state",
        "cybercriminal",
        "single-operator",
        "lab-test-eval",
        "researcher",
        "unknown"
      ]
    },
    "autonomy_pct": {
      "description": "Percentage of the operation performed autonomously by the AI agent, only if a source states it. null when unstated.",
      "type": ["integer", "null"],
      "minimum": 0,
      "maximum": 100
    },
    "autonomy_level": {
      "type": "string",
      "description": "Agentic Autonomy Level — a discrete class for how much of the operation the AI executed without human intervention, assessed from sources. 'not-applicable' for incidents where the AI is the victim (e.g. agent-hijack) rather than the operator.",
      "enum": [
        "tool-assisted",
        "human-in-the-loop",
        "supervised-autonomous",
        "fully-autonomous",
        "not-applicable",
        "unknown"
      ]
    },
    "guardrail_bypass": {
      "type": "array",
      "description": "How the model's safety controls were circumvented or sidestepped, per sources.",
      "items": {
        "type": "string",
        "enum": [
          "jailbreak",
          "open-weight-model",
          "legitimate-tool-abuse",
          "indirect-prompt-injection",
          "none-observed",
          "unknown"
        ]
      },
      "uniqueItems": true
    },
    "ai_role": {
      "type": "string",
      "description": "Editorial assessment of how central AI actually was to the incident — a skepticism axis independent of status. 'incidental' where sources indicate AI was a productivity aid rather than load-bearing; 'disputed' where sources conflict or a vendor's framing is contested.",
      "enum": ["load-bearing", "significant", "incidental", "disputed", "unknown"]
    },
    "related": {
      "type": "array",
      "description": "Ids of other records in this dataset related to this one (same disclosure/report, campaign, actor, or closely related technique/product). Every id must resolve to an existing record; enforced by validate.",
      "items": { "type": "string", "pattern": "^[a-z0-9]+(-[a-z0-9]+)*$" },
      "uniqueItems": true
    },
    "mitigations": {
      "type": "array",
      "description": "Defensive measures or detections as described by sources — defensive framing only, no offensive detail.",
      "items": { "type": "string", "minLength": 1 },
      "uniqueItems": true
    },
    "record_status": {
      "type": "string",
      "description": "Lifecycle of this dataset record itself (not the incident). Omitted means 'active'. 'disputed' = sources conflict or the framing is contested; 'retracted' = withdrawn but kept for citation stability; 'superseded' = replaced by another record (set superseded_by).",
      "enum": ["active", "disputed", "retracted", "superseded"]
    },
    "superseded_by": {
      "type": "string",
      "description": "Id of the record that supersedes this one. Required when record_status is 'superseded'; must resolve to an existing record (enforced by validate).",
      "pattern": "^[a-z0-9]+(-[a-z0-9]+)*$"
    },
    "revisions": {
      "type": "array",
      "description": "Append-only audit trail of material corrections or retractions. Routine edits just bump last_updated; use this for substantive changes reviewers should see.",
      "items": {
        "type": "object",
        "additionalProperties": false,
        "required": ["date", "note"],
        "properties": {
          "date": { "type": "string", "format": "date" },
          "note": { "type": "string", "minLength": 3 }
        }
      }
    },
    "targets": {
      "type": "object",
      "additionalProperties": false,
      "properties": {
        "orgs_affected": {
          "type": ["integer", "null"],
          "minimum": 0,
          "description": "Number of organizations affected, only if a source states it."
        },
        "records_exfiltrated": {
          "type": ["integer", "null"],
          "minimum": 0,
          "description": "Number of records exfiltrated, only if a source states it."
        },
        "sectors": {
          "type": "array",
          "items": { "type": "string", "minLength": 1 },
          "uniqueItems": true
        },
        "countries": {
          "type": "array",
          "description": "ISO 3166-1 alpha-2 country codes of targets, as stated by sources.",
          "items": { "type": "string", "pattern": "^[A-Z]{2}$" },
          "uniqueItems": true
        }
      }
    },
    "geo": {
      "type": "object",
      "additionalProperties": false,
      "description": "Map points for the tracker. Omit geo entirely when no cited source states a location. Each point carries an explicit, validated basis (why it exists) and the publisher that stated it; targets.countries is never turned into points.",
      "required": ["points"],
      "properties": {
        "points": {
          "type": "array",
          "minItems": 1,
          "items": { "$ref": "#/$defs/geoPoint" }
        }
      }
    },
    "lifecycle_phases": {
      "type": "array",
      "description": "Attack lifecycle phases observed, per sources. Descriptive only — no operational detail.",
      "items": {
        "type": "string",
        "enum": [
          "recon",
          "resource-dev",
          "initial-access",
          "execution",
          "credential-access",
          "privilege-escalation",
          "persistence",
          "exfiltration",
          "deception-social-eng",
          "impact"
        ]
      },
      "uniqueItems": true
    },
    "mappings": {
      "type": "object",
      "additionalProperties": false,
      "description": "External framework IDs exactly as published — never invent an ID. mitre_atlas preferred for AI-native techniques; mitre_attack for traditional TTPs.",
      "properties": {
        "mitre_atlas": {
          "type": "array",
          "description": "MITRE ATLAS technique, tactic or mitigation IDs (AML.T/TA/M). Case studies go in mitre_atlas_case_studies.",
          "items": { "type": "string", "pattern": "^AML\\.(T|TA|M)[0-9]{4}(\\.[0-9]{3})?$" },
          "uniqueItems": true
        },
        "mitre_atlas_case_studies": {
          "type": "array",
          "description": "MITRE ATLAS case-study IDs (AML.CSnnnn) that document this incident, exactly as published.",
          "items": { "type": "string", "pattern": "^AML\\.CS[0-9]{4}$" },
          "uniqueItems": true
        },
        "mitre_attack": {
          "type": "array",
          "items": { "type": "string", "pattern": "^(T|TA|S|G|M)[0-9]{4}(\\.[0-9]{3})?$" },
          "uniqueItems": true
        },
        "owasp_llm": {
          "type": "array",
          "description": "OWASP Top 10 for LLM Applications IDs, e.g. LLM01.",
          "items": { "type": "string", "pattern": "^LLM[0-9]{2}$" },
          "uniqueItems": true
        },
        "owasp_asi": {
          "type": "array",
          "description": "OWASP Agentic Security Initiative (ASI) threat IDs, e.g. T1. Distinct from the LLM Top 10 — use owasp_llm for those.",
          "items": { "type": "string", "minLength": 2 },
          "uniqueItems": true
        },
        "cve": {
          "type": "array",
          "items": { "type": "string", "pattern": "^CVE-[0-9]{4}-[0-9]{4,}$" },
          "uniqueItems": true
        },
        "aiid": {
          "type": "array",
          "description": "AI Incident Database incident numbers.",
          "items": { "type": "integer", "minimum": 1 },
          "uniqueItems": true
        }
      }
    },
    "impact": {
      "type": ["string", "null"],
      "description": "Stated impact (financial, data, operational), only as sources describe it."
    },
    "sources": {
      "type": "array",
      "description": "Every record needs at least one resolvable source. No source, no record.",
      "minItems": 1,
      "items": {
        "type": "object",
        "additionalProperties": false,
        "required": ["title", "url", "publisher", "type"],
        "properties": {
          "title": { "type": "string", "minLength": 3 },
          "url": { "type": "string", "format": "uri", "pattern": "^https?://" },
          "archive_url": {
            "type": "string",
            "format": "uri",
            "pattern": "^https?://",
            "description": "Optional archival snapshot (e.g. Wayback Machine) so the record survives link rot. Must resolve independently of url."
          },
          "publisher": { "type": "string", "minLength": 1 },
          "type": {
            "type": "string",
            "enum": [
              "first-party-disclosure",
              "vendor-report",
              "government-advisory",
              "research-paper",
              "news",
              "blog",
              "other"
            ]
          },
          "date": { "type": "string", "format": "date" }
        }
      }
    },
    "added": {
      "type": "object",
      "additionalProperties": false,
      "required": ["date", "by"],
      "properties": {
        "date": { "type": "string", "format": "date" },
        "by": { "type": "string", "minLength": 1 }
      }
    },
    "last_updated": {
      "type": "string",
      "format": "date"
    }
  },
  "$defs": {
    "geoPoint": {
      "type": "object",
      "additionalProperties": false,
      "required": ["role", "basis", "attributed_by", "country", "lat", "lng", "label", "illustrative"],
      "properties": {
        "role": {
          "type": "string",
          "description": "origin = where the attack came from (by the stated basis); target = where it was aimed.",
          "enum": ["origin", "target"]
        },
        "basis": {
          "type": "string",
          "description": "Why this point exists, as a cited source states it (see taxonomy/geo-basis.yml). A state sponsor is not an operator location.",
          "enum": [
            "sponsor-attribution",
            "operator-location",
            "actor-location",
            "infrastructure",
            "victim-location",
            "stated-location"
          ]
        },
        "attributed_by": {
          "type": "string",
          "description": "Publisher that stated the basis. Must exactly equal a sources[].publisher on this record (enforced by validate).",
          "minLength": 1
        },
        "country": {
          "description": "ISO 3166-1 alpha-2 code of the point. null only for a non-country region centroid (illustrative: true).",
          "oneOf": [{ "type": "string", "pattern": "^[A-Z]{2}$" }, { "type": "null" }]
        },
        "lat": { "type": "number", "minimum": -90, "maximum": 90 },
        "lng": { "type": "number", "minimum": -180, "maximum": 180 },
        "label": { "type": "string", "minLength": 1 },
        "illustrative": {
          "type": "boolean",
          "description": "true when the point is a country/region centroid rather than a precise, source-stated location. Required true for every basis except stated-location, which requires false."
        }
      }
    }
  }
}
