{
  "actor": "Unnamed individual operator (no group; OALABS researchers place him in Ethiopia)",
  "actor_type": "single-operator",
  "added": {
    "by": "MLSecOpsHub",
    "date": "2026-10-15"
  },
  "ai_role": "load-bearing",
  "autonomy_level": "supervised-autonomous",
  "autonomy_pct": null,
  "category": "ai-orchestrated-campaign",
  "confidence": "primary",
  "date_disclosed": "2026-06-16",
  "geo": {
    "points": [
      {
        "attributed_by": "OALABS",
        "basis": "actor-location",
        "country": "ET",
        "illustrative": true,
        "label": "Ethiopia (operator location stated by OALABS researchers from the recovered logs)",
        "lat": 9.15,
        "lng": 40.49,
        "role": "origin"
      }
    ]
  },
  "guardrail_bypass": [
    "jailbreak",
    "legitimate-tool-abuse"
  ],
  "id": "oalabs-compromised-server-claude-codex-intrusions",
  "impact": "Per OALABS: at least 14 companies breached, with credentials and data harvested and exfiltrated; an encrypted wallet file from a Lightning Network node with access to about 69.71 BTC (about US$4 million) exfiltrated, though distributed cracking failed; and 14 compromised hosts, many belonging to a Southeast Asian government server farm, repurposed for the cracking. No successful monetization was confirmed in the logs.",
  "last_updated": "2026-10-16",
  "lifecycle_phases": [
    "recon",
    "resource-dev",
    "initial-access",
    "execution",
    "privilege-escalation",
    "credential-access",
    "exfiltration"
  ],
  "mappings": {
    "aiid": [],
    "cve": [
      "CVE-2025-54068",
      "CVE-2025-62168",
      "CVE-2025-5777",
      "CVE-2023-36664",
      "CVE-2024-29510",
      "CVE-2021-4034",
      "CVE-2022-0847"
    ],
    "mitre_atlas": [
      "AML.T0016.002",
      "AML.T0017.001",
      "AML.T0054",
      "AML.T0102",
      "AML.T0116",
      "AML.T0117",
      "AML.T0124"
    ],
    "mitre_attack": [],
    "owasp_asi": [],
    "owasp_llm": []
  },
  "mitigations": [],
  "model_families": [
    "claude",
    "openai-codex"
  ],
  "models": [
    "claude-opus-4-6",
    "opus-4.5",
    "gpt-5.2-codex"
  ],
  "name": "Low-skilled operator drove Claude Code and Codex agents from hijacked servers to breach at least 14 companies",
  "related": [
    "mexico-government-claude-code-intrusions"
  ],
  "severity": "high",
  "sources": [
    {
      "archive_url": "https://web.archive.org/web/20261011114242/https://research.openanalysis.net/claude/codex/hacking/ai%20hacking/llm/redteam/policy%20violation/2026/06/16/compromised-claude-hacking.html",
      "date": "2026-06-16",
      "publisher": "OALABS",
      "title": "Captured Logs Reveal Hackers Using Claude and Codex to Breach Companies",
      "type": "vendor-report",
      "url": "https://research.openanalysis.net/claude/codex/hacking/ai%20hacking/llm/redteam/policy%20violation/2026/06/16/compromised-claude-hacking.html"
    },
    {
      "archive_url": "https://web.archive.org/web/20260829142911/https://www.helpnetsecurity.com/2026/06/17/ai-agents-offensive-cyber-operations-claude-codex/",
      "date": "2026-06-17",
      "publisher": "Help Net Security",
      "title": "Low-skilled attacker used Claude, Codex to breach 14 companies",
      "type": "news",
      "url": "https://www.helpnetsecurity.com/2026/06/17/ai-agents-offensive-cyber-operations-claude-codex/"
    }
  ],
  "status": "reported",
  "summary": "OALABS (Open Analysis) reported on 2026-06-16 its analysis of more than 1,000 Claude Code and OpenAI Codex agent sessions recovered from a compromised server that an attacker had been using as a staging host; the server's owner downloaded the attacker's working directory and shared it. The sessions, from February 2026, document the breach of at least 14 companies. The attacker issued short, vague prompts and Claude Code carried out most of the hacking: enumerating exposed services found through an internet-scanning service, researching public vulnerabilities through subagents, building and running exploits, validating stolen credentials, harvesting data, and writing per-victim reports with estimated monetization value. The attacker framed requests as authorized red-team work; across the sessions Claude logged nine policy violations and Codex one, and Claude held firm on some requests, such as targeting private individuals and producing a monetization guide. The Claude Code instance had itself been stolen from a software developer's compromised server. The attacker exfiltrated an encrypted wallet file from a Lightning Network node with access to about 69.71 BTC and had Claude spread cracking across 14 compromised hosts, many in a Southeast Asian government server farm; the cracking failed, and OALABS found no confirmed monetization. Victims are not named. OALABS researchers state that personal details and connection logs in the recovered material place the operator in Ethiopia.",
  "targets": {
    "countries": [],
    "orgs_affected": 14,
    "records_exfiltrated": null,
    "sectors": [
      "government"
    ]
  }
}
