{
  "actor": "Meta internal AI agent (faulty guidance; no external attacker)",
  "actor_type": "unknown",
  "added": {
    "by": "MLSecOpsHub",
    "date": "2026-10-10"
  },
  "ai_role": "significant",
  "autonomy_level": "not-applicable",
  "autonomy_pct": null,
  "category": "autonomous-attack",
  "confidence": "secondary",
  "date_disclosed": "2026-03-19",
  "guardrail_bypass": [
    "none-observed"
  ],
  "id": "meta-internal-agent-sev1-data-exposure",
  "impact": "Sensitive internal company information temporarily exposed to employees without normal access after an internal AI agent gave incorrect guidance; Sev-1 alert, contained in about two hours. Meta states no data left the company and no external user data was compromised.",
  "last_updated": "2026-10-10",
  "lifecycle_phases": [
    "execution",
    "impact"
  ],
  "mappings": {
    "aiid": [],
    "cve": [],
    "mitre_atlas": [],
    "mitre_attack": [],
    "owasp_asi": [],
    "owasp_llm": []
  },
  "mitigations": [
    "Meta restricted access and reviewed the systems involved and said it would strengthen controls on AI agents in sensitive processes, including better validation of AI-generated responses, limits on automated permissions and more human oversight of critical tasks (per INCIBE-CERT)."
  ],
  "model_families": [
    "other"
  ],
  "models": [],
  "name": "Meta internal AI agent gave faulty guidance that briefly exposed sensitive data to unauthorized staff",
  "related": [
    "openclaw-inbox-deletion",
    "aepd-first-ai-agent-data-breach-notification"
  ],
  "severity": "medium",
  "sources": [
    {
      "date": "2026-04-16",
      "publisher": "INCIBE-CERT",
      "title": "AI incident at Meta drives improvements in the security and control of autonomous systems",
      "type": "government-advisory",
      "url": "https://www.incibe.es/en/incibe-cert/publications/cybersecurity-highlights/ai-incident-meta-drives-improvements-security-and-control-autonomous-systems"
    },
    {
      "archive_url": "https://web.archive.org/web/20260609122231/https://securitybrief.asia/story/meta-ai-agent-exposes-sensitive-data-in-internal-leak",
      "date": "2026-03-25",
      "publisher": "SecurityBrief Asia",
      "title": "Meta AI agent exposes sensitive data in internal leak",
      "type": "news",
      "url": "https://securitybrief.asia/story/meta-ai-agent-exposes-sensitive-data-in-internal-leak"
    }
  ],
  "status": "reported",
  "summary": "In mid-March 2026 an internal AI agent at Meta, consulted by an engineer on a corporate forum, provided incorrect guidance that the engineer followed, temporarily exposing sensitive internal company information to employees who would not normally have access. INCIBE-CERT (Spain's national cybersecurity institute) summarised the incident on 2026-04-16, and SecurityBrief Asia reported on 2026-03-25 that it triggered a Sev-1 internal alert and lasted about two hours before Meta's security teams detected and contained it. Meta confirmed the incident, attributing it to inaccurate AI-generated information acted on without further verification, and said the data did not leak outside the company and no external user data was compromised. Meta classified it as high severity and restricted access, reviewed the systems involved and said it would strengthen controls on AI agents in sensitive processes.",
  "targets": {
    "countries": [],
    "orgs_affected": 1,
    "records_exfiltrated": null,
    "sectors": [
      "technology"
    ]
  }
}
