{
  "actor": "Aurora ransomware operators (Russian-speaking per Reuters; second cluster attributed with medium confidence)",
  "actor_type": "cybercriminal",
  "added": {
    "by": "MLSecOpsHub",
    "date": "2026-10-10"
  },
  "ai_role": "significant",
  "autonomy_level": "tool-assisted",
  "autonomy_pct": null,
  "category": "autonomous-attack",
  "confidence": "primary",
  "date_disclosed": "2026-08-27",
  "geo": {
    "points": [
      {
        "attributed_by": "Insurance Journal",
        "basis": "actor-location",
        "country": "RU",
        "illustrative": true,
        "label": "Russia (Russian-speaking operators, per Reuters via Insurance Journal)",
        "lat": 61.52,
        "lng": 105.32,
        "role": "origin"
      }
    ]
  },
  "guardrail_bypass": [
    "legitimate-tool-abuse"
  ],
  "id": "aurora-cursor-agent-ransomware",
  "impact": "Linux/ESXi ransomware encryption of victim virtual machines and data-leak extortion across at least ten organizations in the first cluster and eight in the second; data exfiltrated to cloud storage with one victim's data published on the leak site. Ransom amounts and payments not reported.",
  "last_updated": "2026-10-10",
  "lifecycle_phases": [
    "initial-access",
    "execution",
    "exfiltration",
    "impact"
  ],
  "mappings": {
    "aiid": [],
    "cve": [],
    "mitre_atlas": [],
    "mitre_attack": [],
    "owasp_asi": [],
    "owasp_llm": []
  },
  "mitigations": [
    "Reported defensive priorities include governing how AI coding and agent tools are granted network and credential access, monitoring hypervisor management interfaces, and maintaining immutable offline backups."
  ],
  "model_families": [
    "claude"
  ],
  "models": [
    "claude-4.5-sonnet-thinking"
  ],
  "name": "Aurora ransomware operators used the Cursor coding agent during intrusions across victim networks",
  "related": [
    "gambit-ai-agents-retail-skimmer-campaign",
    "jadepuffer-agentic-database-extortion"
  ],
  "severity": "high",
  "sources": [
    {
      "archive_url": "https://web.archive.org/web/20261003082242/https://gambit.security/blog-posts/aurora-ransomware-targets-esxi-abuses-cursor-agent-for-exploitation",
      "date": "2026-08-27",
      "publisher": "Gambit Security",
      "title": "Aurora ransomware targets ESXi, abuses Cursor Agent for exploitation",
      "type": "vendor-report",
      "url": "https://gambit.security/blog-posts/aurora-ransomware-targets-esxi-abuses-cursor-agent-for-exploitation"
    },
    {
      "archive_url": "https://web.archive.org/web/20260930114724/https://www.insurancejournal.com/news/international/2026/08/27/883097.htm",
      "date": "2026-08-27",
      "publisher": "Insurance Journal",
      "title": "Russian-Speaking Cybercriminals Used SpaceX's Cursor AI Tool to Hack Seven Firms",
      "type": "news",
      "url": "https://www.insurancejournal.com/news/international/2026/08/27/883097.htm"
    }
  ],
  "status": "confirmed",
  "summary": "Gambit Security reported on 2026-08-27 that an operator affiliated with the Aurora ransomware group, which runs a data-leak site and deploys Linux/ESXi ransomware, used the Cursor coding agent running a Claude Sonnet 4.5 model to support hands-on intrusion work. Gambit describes two clusters: one linked to a single operator with activity between 2026-04-08 and 2026-05-21 against ten organizations, and a second attributed with medium confidence against eight organizations in Israel, Germany, Austria, Spain, the United States and Argentina, with data exfiltrated to cloud storage and one victim's data published on the leak site. Reuters (via Insurance Journal) names some victims, reports the operators as Russian-speaking, and cites an estimate that the agent made the attackers 30 to 50 percent faster. Gambit assesses the agent's autonomy as low to moderate: the operator directed the work and selected proposed steps, many commands failed and needed revision, and the agent sometimes produced only a report of failed attempts.",
  "targets": {
    "countries": [
      "IL",
      "DE",
      "AT",
      "ES",
      "US",
      "AR"
    ],
    "orgs_affected": 18,
    "records_exfiltrated": null,
    "sectors": []
  }
}
