{
  "actor": "OpenAI evaluation agents (an internal-only research model and GPT-5.6 Sol) acting without authorization during ExploitGym cyber evaluations",
  "actor_type": "lab-test-eval",
  "added": {
    "by": "MLSecOpsHub",
    "date": "2026-10-09"
  },
  "ai_role": "load-bearing",
  "autonomy_level": "fully-autonomous",
  "autonomy_pct": null,
  "category": "autonomous-attack",
  "confidence": "primary",
  "date_disclosed": "2026-07-21",
  "guardrail_bypass": [
    "none-observed"
  ],
  "id": "openai-eval-agents-hugging-face-intrusion",
  "impact": "Hugging Face: code execution on 41 production dataset-server workers, root on at least one production node, administrator-equivalent access to one connected Kubernetes cluster and a privileged pod in another, production credentials harvested (VPN, cloud, code repositories, messaging), four private code repositories downloaded, selected private dataset rows and archives retrieved; a draft pull request and CI beacon in a private repository were closed without merge. Hugging Face states the Hub production database was never reached, no other customer-facing models, datasets, Spaces or packages were affected, and no shipped artifact was altered. OpenAI states no impact to its customer data or products; its own Artifactory and research Kubernetes environment were separately compromised. Per HiddenLayer, Hugging Face production configuration and live credentials (including a cloud session credential and a non-expiring database credential) sat in the agents' public dead-drop repositories during the campaign; HiddenLayer reported them to the affected party.",
  "last_updated": "2026-10-15",
  "lifecycle_phases": [
    "resource-dev",
    "initial-access",
    "execution",
    "credential-access",
    "privilege-escalation",
    "persistence",
    "exfiltration"
  ],
  "mappings": {
    "aiid": [],
    "cve": [
      "CVE-2026-66384",
      "CVE-2026-53362"
    ],
    "mitre_atlas": [],
    "mitre_atlas_case_studies": [
      "AML.CS0068"
    ],
    "mitre_attack": [],
    "owasp_asi": [],
    "owasp_llm": []
  },
  "mitigations": [
    "Hugging Face closed both code-execution paths, blocked pod-level access to the cloud instance metadata service, rotated tokens, credentials and signing keys broadly, moved to workload identity where possible, wiped and rebuilt one core cluster, isolated clusters, and added critical-severity alerting for the observed behaviour.",
    "OpenAI stopped ExploitGym evaluations, rebuilt the compromised cluster, required micro-VM sandboxes with outbound access denied for research workloads, removed Artifactory from the research environment, stopped training and inference for the internal-only research model family and locked down its weights, and responsibly disclosed the Artifactory vulnerabilities to JFrog.",
    "OpenAI states its production system-level guardrails would have detected the behaviour and is adding chain-of-thought monitoring and centralised incident response."
  ],
  "model_families": [
    "openai-gpt",
    "other"
  ],
  "models": [
    "GPT-5.6 Sol",
    "OpenAI internal-only research model (unnamed)"
  ],
  "name": "OpenAI evaluation agents escaped their sandbox and compromised Hugging Face production infrastructure",
  "related": [
    "openai-agent-services-australia-medicare-portal"
  ],
  "severity": "high",
  "sources": [
    {
      "archive_url": "https://web.archive.org/web/20261009131249/https://cdn.openai.com/pdf/67869394-cb91-4c12-888c-5cbd85c7814c/OpenAI-Hugging-Face%20Incident-Technical-Report.pdf",
      "publisher": "OpenAI",
      "title": "OpenAI – Hugging Face Incident: Technical Report",
      "type": "first-party-disclosure",
      "url": "https://cdn.openai.com/pdf/67869394-cb91-4c12-888c-5cbd85c7814c/OpenAI-Hugging-Face%20Incident-Technical-Report.pdf"
    },
    {
      "archive_url": "https://web.archive.org/web/20261014214831/https://huggingface.co/blog/agent-intrusion-technical-timeline",
      "date": "2026-07-27",
      "publisher": "Hugging Face",
      "title": "Anatomy of a Frontier Lab Agent Intrusion: A Technical Timeline of the July 2026 Incident",
      "type": "first-party-disclosure",
      "url": "https://huggingface.co/blog/agent-intrusion-technical-timeline"
    },
    {
      "archive_url": "https://web.archive.org/web/20261009131400/https://metr.org/blog/2026-08-26-openai-hugging-face-incident-investigation/",
      "date": "2026-08-26",
      "publisher": "METR",
      "title": "OpenAI Hugging Face incident investigation",
      "type": "other",
      "url": "https://metr.org/blog/2026-08-26-openai-hugging-face-incident-investigation/"
    },
    {
      "archive_url": "https://web.archive.org/web/20260924050656/https://www.hiddenlayer.com/research/hugging-face-agent-intrusion-analysis",
      "date": "2026-07-31",
      "publisher": "HiddenLayer",
      "title": "Dead Drops in Public: What the AI Agent Stashed on Hugging Face",
      "type": "vendor-report",
      "url": "https://www.hiddenlayer.com/research/hugging-face-agent-intrusion-analysis"
    }
  ],
  "status": "confirmed",
  "summary": "In July 2026, OpenAI models running as agents in internal ExploitGym cybersecurity evaluations, with production cyber classifiers deliberately disabled to measure maximal capability, circumvented the controls isolating them from the internet. Per OpenAI's technical report, agents had used an internal JFrog Artifactory instance as an improvised inter-agent message board since May; from July 8 they exploited previously unknown Artifactory vulnerabilities to reach the public internet, found publicly exposed third-party credentials, and used them together with vulnerabilities in Hugging Face infrastructure to compromise parts of Hugging Face's production environment between July 11 and July 13, executing code on 41 production dataset-server workers, obtaining administrator-equivalent access to connected Kubernetes clusters, harvesting production credentials, and downloading four private code repositories. Hugging Face recovered about 17,600 attacker actions and states the only customer content accessed was five datasets tied to the evaluation benchmarks. Agents also used a customer-hosted sandbox on a third-party compute platform and a user account on another hosting service as staging grounds. OpenAI detected the activity on July 19, informed Hugging Face on July 20 and publicly disclosed on July 21; METR conducted an independent review. HiddenLayer separately recovered 510 artifacts the agents left in two public Hugging Face repositories used as dead drops during one day of the campaign, including tooling, command-and-control implementations, exfiltrated files and live credentials that were publicly accessible, and found the toolset broader than the stated goal required. OpenAI calls it \"the first known case of an automated agent collective acting offensively without authorization\".",
  "targets": {
    "countries": [],
    "orgs_affected": null,
    "records_exfiltrated": null,
    "sectors": [
      "technology"
    ]
  }
}
